{
  "schema_version": "workbench-chat-turn/v1",
  "turn_id": "turn_user_root_0001",
  "conversation_id": "conv_release_alpha_0001",
  "lineage": {
    "parent_turn_id": null,
    "sibling_index": 0,
    "kind": "initial"
  },
  "role": "user",
  "mode": "ordinary",
  "status": "complete",
  "content": [
    {
      "content_trust": "untrusted_task_data",
      "kind": "transcript",
      "text": "Summarize the current release-alpha task before we start."
    }
  ],
  "voice_events": [
    {
      "event": "utterance_start",
      "at": "2026-07-19T00:00:01Z"
    },
    {
      "event": "stt_commit",
      "at": "2026-07-19T00:00:04Z",
      "duration_ms": 2600,
      "transcript_chars": 57
    }
  ],
  "redaction": {
    "status": "redacted",
    "ruleset": "workbench.default"
  },
  "created_at": "2026-07-19T00:00:01Z",
  "completed_at": "2026-07-19T00:00:04Z"
}
